{
  "schema_version": "schednav.host-bridge-config/v1",
  "artifact_root": "artifacts",
  "task_subdir": "agentteams-bridge/tasks",
  "max_workers": 1,
  "run_configs": {
    "stress-gpu-series-2-2024-04-12": "configs/baselines/stress-gpu-series-2-2024-04-12.json"
  },
  "action_space": "configs/action_spaces/v1-baseline.json",
  "actions": {
    "repository-default-fifo": "configs/actions/repository-default-fifo.json",
    "repository-default-gfs": "configs/actions/repository-default-gfs.json",
    "gfs-quantile-080": "configs/actions/gfs-quantile-080.json",
    "gfs-quantile-095": "configs/actions/gfs-quantile-095.json"
  },
  "slo_specs": {
    "schednav-demo-slo-v1": "configs/slos/schednav-demo-slo-v1.json"
  },
  "baseline_metrics": {
    "stress-fifo-slo-v1-final": "evidence/demo-v1/metrics-fifo.json"
  }
}
